"URL","T_court","T_long","Description","Photo_1","Photo_2","Photo_3","Type","nb_ch","nb_sdb","surf_hab","surf_jar","prix","com","dep","com_name","com_insee","dep_name","reg_name","Lat","Long"
"https://analytics.huma-num.fr/Robin.Cura/ScrapImmob/annonces/Normandie_0439.html","Maison charmante de 113m² avec jardin de 200m² à vendre à Saint-Paër, Normandie","Trouverez-vous vos rêves réunis ? 🌸 Le jardin de 200 m² est idéal pour pique-niquer ou se détendre en famille 😌 Apprenez-en davantage sur cette magnifique maison à Saint-Paër, en Normandie !","Cette magnifique maison de 113 m², située dans la commune de Saint-Paër, en région Normandie, offre toutes les commodités nécessaires à une vie heureuse et agréable. Disponible à vendre pour un montant de 225 000 €, cette demeure est composée de 4 chambres et 2 salles de bain, permettant ainsi d'accueillir une famille nombreuse ou d'offrir de l'espace aux amis lors des réunions festives. Son jardin de 200 m², entièrement clos et entouré d'arbres, constitue un lieu privilégié de détente et de loisirs pour les occupants et leurs proches. Les installations sont modernes et fonctionnels, avec une cuisine équipée de tous les ustensiles nécessaires pour préparer des repas savoureux. La proximité des infrastructures et des services (écoles, commerces, transports) rend cette propriété encore plus attrayante.","../images_1000/Normandie_0439_1.png","../images_1000/Normandie_0439_2.png","../images_1000/Normandie_0439_3.png","Maison",4,2,113,200,225000,"Saint-Paër (76631)","Seine-Maritime (Normandie)","Saint-Paër","76631","Seine-Maritime","Normandie",49.5165834417516,0.902879998999503
"https://analytics.huma-num.fr/Robin.Cura/ScrapImmob/annonces/Normandie_0296.html","Maison charmante avec jardin, 4 chambres, 3 salles de bain - Notre-Dame-de-Bondeville (Normandie) - 245 000 €","Maison de rêve de 106 m², jardin de 285 m², 4 chambres, 3 salles de bain, village pittoresque de Notre-Dame-de-Bondeville, région Normandie, à vendre pour 245 000 €.","Bien immobilier unique, cette belle maison de 106 m² offre une jolie surprise avec son magnifique jardin de 285 m². Située dans le charmeux village de Notre-Dame-de-Bondeville, à l'est de Rouen, il s'agit d'une acquisition idéale pour une famille ou un couple qui apprécient la nature et le cadre paisible. Cette propriété comprend 4 chambres et 3 salles de bain, pour une superficie totale de 285 m², permettant une vie confortable et pratique. L'entrée principale donne accès à un hall d'accueil spacieux et lumineux, ainsi qu'à une salle de séjour charmante et éclairée par de grandes fenêtres. La cuisine est équipée de tout ce dont vous avez besoin pour préparer vos repas quotidiens ou vos délices gastronomiques. Il y a également un espace dédié aux animaux de compagnie, un garage pour vos véhicules et un espace de stockage pour vos outils ou votre patrimoine. Tout près, vous trouverez des écoles, des commerces et des transports en commun pour faciliter vos déplacements quotidiens. Ne ratez pas cette occasion unique d'acquérir cette maison à prix abordable, nous sommes là pour vous accompagner dans votre projet !","../images_1000/Normandie_0296_1.png","../images_1000/Normandie_0296_2.png","../images_1000/Normandie_0296_3.png","Maison",4,3,106,285,245000,"Notre-Dame-de-Bondeville (76474)","Seine-Maritime (Normandie)","Notre-Dame-de-Bondeville","76474","Seine-Maritime","Normandie",49.4880879262546,1.04838775865522
"https://analytics.huma-num.fr/Robin.Cura/ScrapImmob/annonces/Normandie_0110.html","Maison charmante à Elbeuf - 3 chambres, 2 salles de bain, 52m², jardin 45m²","Maisond'époque de 52m² avec jardin de 45m², 3 chambres et 2 salles de bain, à Elbeuf (Normandie), 95 000€.","Cette maison ancienne, située au cœur d'Elbeuf, offre une ambiance chaleureuse et conviviale. Avec ses 52 mètres carrés habitable, elle est composée de 3 chambres et 2 salles de bain, permettant ainsi d'accueillir confortablement une petite famille ou quelques amis. Le jardin de 45 mètres carrés complète cet espace tout en plaisir grâce à sa verdure et son décoration soignée. L'ensemble donne sur l'architecture locale, et constitue un lieu idéal pour les promeneurs et les amoureux de la nature. Enfin, l'investissement d'une valeur de 95 000 € permet de réaliser un rêve de propriété privilégié.
Découvrez ce trésor inespéré et soyez le premier à profiter de cette maison charmante à Elbeuf.","../images_1000/Normandie_0110_1.png","../images_1000/Normandie_0110_2.png","../images_1000/Normandie_0110_3.png","Maison",3,2,52,45,95000,"Elbeuf (76231)","Seine-Maritime (Normandie)","Elbeuf","76231","Seine-Maritime","Normandie",49.2627044246444,1.02114206198306
"https://analytics.huma-num.fr/Robin.Cura/ScrapImmob/annonces/Normandie_0418.html","Maison charmeuse de 115m² avec jardin privatif de 125m² à Saint-Aubin-Celloville, région Normandie","Découvrez cette magnifique maison de caractère de 115m² avec 5 chambres et 4 salles de bain dans le calme de la commune de Saint-Aubin-Celloville, en région Normandie. Profitez d'un jardin privatif de 125m² et d'une vie rurale paisible. À vendre à 220 000€.","Cette magnifique maison de caractère de 115m² est située dans la tranquille commune de Saint-Aubin-Celloville, en région Normandie. Elle offre une vue imprenable sur les montagnes et une ambiance naturelle complète. La maison est composée de 5 chambres et 4 salles de bain, ce qui en fait un excellent investissement familial. Le jardin privatif de 125m² offre un espace vert idéal pour les loisirs en plein air et pour accueillir votre famille et vos amis. L'accès à la ville est facile grâce à sa position stratégique. Ne manquez pas cette occasion unique de vivre dans un cadre paisible et luxueux.","../images_1000/Normandie_0418_1.png","../images_1000/Normandie_0418_2.png","../images_1000/Normandie_0418_3.png","Maison",5,4,115,125,220000,"Saint-Aubin-Celloville (76558)","Seine-Maritime (Normandie)","Saint-Aubin-Celloville","76558","Seine-Maritime","Normandie",49.371358942379,1.15472007776298
"https://analytics.huma-num.fr/Robin.Cura/ScrapImmob/annonces/Normandie_0069.html","Maison charmante à Caudebec-lès-Elbeuf","Magnifique maison de 112 m² avec jardin de 200 m², 6 chambres, 2 salles de bain, à vendre à 135 000 €.","135 000 €. Ne ratez pas cette opportunité unique pour devenir propriétaire d'une maison de charme en région Normandie.","../images_1000/Normandie_0069_1.png","../images_1000/Normandie_0069_2.png","../images_1000/Normandie_0069_3.png","Maison",6,2,112,200,135000,"Caudebec-lès-Elbeuf (76165)","Seine-Maritime (Normandie)","Caudebec-lès-Elbeuf","76165","Seine-Maritime","Normandie",49.2897225156209,1.02462027792091
